{
  "$comment": "★ 全项目端口【唯一真源】（CONVENTIONS §18）。gbe-studio/bridges/registry.json 是从本文件生成/校验的只读视图，禁止成为第二真源。修改端口只改这里，然后跑 studio 的 `node bridges/sync-ports.js`。",
  "ports_version": "1",
  "updated_at": "2026-10-17",
  "owner": "gbe-assets",
  "ports": [
    {
      "id": "godot-mcp",
      "port": 9876,
      "protocol": "tcp",
      "owner": "gbe-studio",
      "purpose": "Godot 编辑器桥（godot-mcp 客户端写死，不可改）",
      "required": true
    },
    {
      "id": "blender-mcp",
      "port": 9877,
      "protocol": "tcp",
      "owner": "gbe-studio",
      "purpose": "Blender MCP（与 Godot 错开）",
      "required": true
    },
    {
      "id": "unreal-python-remote-exec",
      "port": 6776,
      "protocol": "udp",
      "owner": "gbe-studio",
      "purpose": "UE5 Python Remote Execution（sam-david/unreal-mcp 首选实现）",
      "required": false
    },
    {
      "id": "unreal-remote-control",
      "port": 30010,
      "protocol": "http",
      "owner": "gbe-studio",
      "purpose": "UE5 Remote Control API",
      "required": false
    },
    {
      "id": "unreal-mcp-official",
      "port": 8000,
      "protocol": "http",
      "owner": "gbe-studio",
      "purpose": "UE 5.8+ 官方 Unreal MCP 插件（嵌在编辑器进程内，本地回环 /mcp）",
      "required": false,
      "status": "reserved",
      "note": "ADR-0007：官方实现已进 mcp.json 但【不预设首选】。8000 为通用端口，冲突风险高 —— 启用前必须探测占用；若官方插件端口可配置，优先改到非通用端口。"
    },
    {
      "id": "unreal-mcp-alt-chir24",
      "port": 8091,
      "protocol": "ws",
      "owner": "gbe-studio",
      "purpose": "UE5 备选 MCP 实现 ChiR24/Unreal_mcp（仅该实现被选为 active 时占用）",
      "required": false
    },
    {
      "id": "unreal-mcp-alt-aadeshrao123",
      "port": 55557,
      "protocol": "tcp",
      "owner": "gbe-studio",
      "purpose": "UE5 备选 MCP 实现 aadeshrao123/Unreal-MCP + ue-cli（仅该实现 active 时占用）",
      "required": false
    },
    {
      "id": "unity-mcp",
      "port": 8090,
      "protocol": "http",
      "owner": "gbe-studio",
      "purpose": "Unity MCP —— 预留，当前不占用",
      "required": false,
      "status": "deferred",
      "note": "ADR-0004：Unity 延后。端口保留以免将来冲突。\n★ 2026-10-17（guild X-0050 / ADR-0029③）：原占 8080，因 8080 已被真实在跑的\n★ qiuyuan-game-ws 实际占用（保留位被实际服务占据 = 这条保留早已失效），\n★ 故把保留位挪到 8090 —— ★ 挪的是「没人用的预留」，不是「已经在听的生产端口」。"
    },
    {
      "id": "qiuyuan-game-ws",
      "port": 8080,
      "protocol": "http",
      "owner": "qiuyuan-dalu",
      "purpose": "虬渊大陆游戏服务端 qydalud —— 客户端 WS（/ws）＋ GM 后台 REST（/api/stats · /api/gm/config）",
      "required": true,
      "note": "★ 登记而非新设：该端口自 2026-10-01 起实际在用（dalu docs/M1-IMPLEMENTATION.md：\n★ 原 8000 让给 UE MCP 后改 8080），此前**从未进本真源** ⇒ 属账实不符，X-0050 补齐。\n★ 改端口只改这里，然后同步 dalu 的 `QYD_LISTEN` 与客户端 `UQYDNetConfig` 默认地址。"
    },
    {
      "id": "gbe-assets-api",
      "port": 8788,
      "protocol": "http",
      "owner": "gbe-assets",
      "purpose": "GBE-Assets REST API",
      "required": true
    },
    {
      "id": "gbe-assets-web",
      "port": 8789,
      "protocol": "http",
      "owner": "gbe-assets",
      "purpose": "GBE-Assets 浏览下载站",
      "required": true
    }
  ]
}
